{
  "$schema": "https://json-schema.org/draft/2020-12/schema",
  "$id": "urn:research-loom:core:capability-handoff:0.1.0",
  "title": "research-loom canonical Capability Handoff",
  "description": "Structured, candidate-only output from a Research Capability. A valid handoff is eligible for canonical adoption review but never performs that adoption itself.",
  "type": "object",
  "additionalProperties": false,
  "required": [
    "schema_version",
    "handoff_id",
    "invocation_id",
    "run_id",
    "project_id",
    "capability",
    "execution_mode",
    "input_pins",
    "preserved_context",
    "validation",
    "outputs",
    "provenance",
    "adoption_boundary",
    "handoff_digest"
  ],
  "properties": {
    "schema_version": {
      "const": "0.1.0"
    },
    "handoff_id": {
      "$ref": "#/$defs/identifier"
    },
    "invocation_id": {
      "$ref": "#/$defs/identifier"
    },
    "run_id": {
      "$ref": "#/$defs/identifier"
    },
    "project_id": {
      "$ref": "#/$defs/identifier"
    },
    "capability": {
      "$ref": "#/$defs/capability_binding"
    },
    "execution_mode": {
      "$ref": "#/$defs/execution_mode"
    },
    "input_pins": {
      "$ref": "#/$defs/input_pins"
    },
    "preserved_context": {
      "$ref": "#/$defs/preserved_context"
    },
    "validation": {
      "$ref": "#/$defs/validation"
    },
    "outputs": {
      "$ref": "#/$defs/outputs"
    },
    "provenance": {
      "$ref": "#/$defs/provenance"
    },
    "adoption_boundary": {
      "$ref": "#/$defs/adoption_boundary"
    },
    "handoff_digest": {
      "$ref": "#/$defs/digest"
    }
  },
  "$defs": {
    "identifier": {
      "type": "string",
      "pattern": "^[A-Za-z0-9][A-Za-z0-9._-]{0,127}$"
    },
    "capability_id": {
      "type": "string",
      "pattern": "^[a-z0-9][a-z0-9._-]{0,127}$"
    },
    "function_id": {
      "type": "string",
      "pattern": "^[a-z0-9][a-z0-9._-]{0,127}$"
    },
    "semver": {
      "type": "string",
      "pattern": "^(0|[1-9][0-9]*)\\.(0|[1-9][0-9]*)\\.(0|[1-9][0-9]*)$"
    },
    "digest": {
      "type": "string",
      "pattern": "^sha256:[0-9a-f]{64}$"
    },
    "execution_mode": {
      "enum": [
        "real",
        "virtual",
        "synthetic_test"
      ]
    },
    "capability_binding": {
      "type": "object",
      "additionalProperties": false,
      "required": [
        "capability_id",
        "capability_version",
        "descriptor_digest",
        "function_id"
      ],
      "properties": {
        "capability_id": {
          "$ref": "#/$defs/capability_id"
        },
        "capability_version": {
          "$ref": "#/$defs/semver"
        },
        "descriptor_digest": {
          "$ref": "#/$defs/digest"
        },
        "function_id": {
          "$ref": "#/$defs/function_id"
        }
      }
    },
    "input_pins": {
      "type": "object",
      "additionalProperties": false,
      "required": [
        "invocation_digest",
        "context_pack_digest",
        "project_config_digest",
        "effective_profile_set_digest",
        "research_snapshot"
      ],
      "properties": {
        "invocation_digest": {
          "$ref": "#/$defs/digest"
        },
        "context_pack_digest": {
          "$ref": "#/$defs/digest"
        },
        "project_config_digest": {
          "$ref": "#/$defs/digest"
        },
        "research_snapshot": {
          "$ref": "#/$defs/research_snapshot_pin"
        },
        "effective_profile_set_digest": {
          "$ref": "#/$defs/digest"
        }
      }
    },
    "research_snapshot_pin": {
      "type": "object",
      "additionalProperties": false,
      "required": [
        "snapshot_id",
        "revision",
        "content_digest"
      ],
      "properties": {
        "snapshot_id": {
          "$ref": "#/$defs/identifier"
        },
        "revision": {
          "type": "integer",
          "minimum": 0
        },
        "content_digest": {
          "$ref": "#/$defs/digest"
        }
      }
    },
    "preserved_context": {
      "type": "object",
      "additionalProperties": false,
      "required": [
        "research_attention_ids",
        "project_guard_ids",
        "effective_constraint_paths"
      ],
      "properties": {
        "research_attention_ids": {
          "type": "array",
          "uniqueItems": true,
          "items": {
            "$ref": "#/$defs/identifier"
          }
        },
        "project_guard_ids": {
          "type": "array",
          "uniqueItems": true,
          "items": {
            "$ref": "#/$defs/identifier"
          }
        },
        "effective_constraint_paths": {
          "type": "array",
          "uniqueItems": true,
          "items": {
            "type": "string",
            "minLength": 1
          }
        }
      }
    },
    "validation_issue": {
      "type": "object",
      "additionalProperties": false,
      "required": [
        "code",
        "severity",
        "message"
      ],
      "properties": {
        "code": {
          "type": "string",
          "pattern": "^[A-Z][A-Z0-9_-]{2,63}$"
        },
        "severity": {
          "enum": [
            "info",
            "warning",
            "error"
          ]
        },
        "message": {
          "type": "string",
          "minLength": 1
        }
      }
    },
    "validation": {
      "type": "object",
      "additionalProperties": false,
      "required": [
        "status",
        "issues"
      ],
      "properties": {
        "status": {
          "enum": [
            "valid",
            "partial",
            "rejected"
          ]
        },
        "issues": {
          "type": "array",
          "items": {
            "$ref": "#/$defs/validation_issue"
          }
        }
      }
    },
    "epistemic_mode": {
      "enum": [
        "empirical",
        "synthetic",
        "unknown"
      ]
    },
    "observation": {
      "type": "object",
      "additionalProperties": false,
      "required": [
        "observation_id",
        "statement",
        "epistemic_mode"
      ],
      "properties": {
        "observation_id": {
          "$ref": "#/$defs/identifier"
        },
        "statement": {
          "type": "string",
          "minLength": 1
        },
        "epistemic_mode": {
          "$ref": "#/$defs/epistemic_mode"
        },
        "evidence_candidate_ids": {
          "type": "array",
          "uniqueItems": true,
          "items": {
            "$ref": "#/$defs/identifier"
          }
        }
      }
    },
    "source_capture": {
      "type": "object",
      "additionalProperties": false,
      "required": [
        "capture_id",
        "origin",
        "locator",
        "content_digest"
      ],
      "properties": {
        "capture_id": {
          "$ref": "#/$defs/identifier"
        },
        "origin": {
          "oneOf": [
            {
              "type": "object",
              "additionalProperties": false,
              "required": [
                "origin_type",
                "resource_reference_id"
              ],
              "properties": {
                "origin_type": {
                  "const": "project_source_reference"
                },
                "resource_reference_id": {
                  "$ref": "#/$defs/identifier"
                }
              }
            },
            {
              "type": "object",
              "additionalProperties": false,
              "required": [
                "origin_type",
                "acquisition_locator"
              ],
              "properties": {
                "origin_type": {
                  "const": "acquired_source"
                },
                "acquisition_locator": {
                  "type": "string",
                  "minLength": 1
                }
              }
            }
          ]
        },
        "locator": {
          "type": "string",
          "minLength": 1
        },
        "content_digest": {
          "$ref": "#/$defs/digest"
        }
      }
    },
    "source_basis": {
      "oneOf": [
        {
          "type": "object",
          "additionalProperties": false,
          "required": [
            "basis_type",
            "resource_reference_id"
          ],
          "properties": {
            "basis_type": {
              "const": "resource_reference"
            },
            "resource_reference_id": {
              "$ref": "#/$defs/identifier"
            }
          }
        },
        {
          "type": "object",
          "additionalProperties": false,
          "required": [
            "basis_type",
            "capture_id"
          ],
          "properties": {
            "basis_type": {
              "const": "source_capture"
            },
            "capture_id": {
              "$ref": "#/$defs/identifier"
            }
          }
        }
      ]
    },
    "evidence_candidate": {
      "type": "object",
      "additionalProperties": false,
      "required": [
        "evidence_candidate_id",
        "statement",
        "source_basis",
        "locator",
        "epistemic_mode"
      ],
      "properties": {
        "evidence_candidate_id": {
          "$ref": "#/$defs/identifier"
        },
        "statement": {
          "type": "string",
          "minLength": 1
        },
        "source_basis": {
          "$ref": "#/$defs/source_basis"
        },
        "locator": {
          "type": "string",
          "minLength": 1
        },
        "epistemic_mode": {
          "$ref": "#/$defs/epistemic_mode"
        },
        "limitations": {
          "type": "array",
          "items": {
            "type": "string",
            "minLength": 1
          }
        }
      }
    },
    "counterevidence_candidate": {
      "type": "object",
      "additionalProperties": false,
      "required": [
        "counterevidence_id",
        "statement",
        "source_basis",
        "locator",
        "epistemic_mode"
      ],
      "properties": {
        "counterevidence_id": {
          "$ref": "#/$defs/identifier"
        },
        "statement": {
          "type": "string",
          "minLength": 1
        },
        "source_basis": {
          "$ref": "#/$defs/source_basis"
        },
        "locator": {
          "type": "string",
          "minLength": 1
        },
        "epistemic_mode": {
          "$ref": "#/$defs/epistemic_mode"
        }
      }
    },
    "candidate_finding": {
      "type": "object",
      "additionalProperties": false,
      "required": [
        "candidate_finding_id",
        "question_ids",
        "statement",
        "supporting_evidence_candidate_ids",
        "counterevidence_candidate_ids",
        "boundary_conditions",
        "limitations",
        "epistemic_mode"
      ],
      "properties": {
        "candidate_finding_id": {
          "$ref": "#/$defs/identifier"
        },
        "question_ids": {
          "type": "array",
          "minItems": 1,
          "uniqueItems": true,
          "items": {
            "$ref": "#/$defs/identifier"
          }
        },
        "statement": {
          "type": "string",
          "minLength": 1
        },
        "supporting_evidence_candidate_ids": {
          "type": "array",
          "uniqueItems": true,
          "items": {
            "$ref": "#/$defs/identifier"
          }
        },
        "counterevidence_candidate_ids": {
          "type": "array",
          "uniqueItems": true,
          "items": {
            "$ref": "#/$defs/identifier"
          }
        },
        "boundary_conditions": {
          "type": "array",
          "items": {
            "type": "string",
            "minLength": 1
          }
        },
        "limitations": {
          "type": "array",
          "items": {
            "type": "string",
            "minLength": 1
          }
        },
        "epistemic_mode": {
          "$ref": "#/$defs/epistemic_mode"
        }
      }
    },
    "conflict": {
      "type": "object",
      "additionalProperties": false,
      "required": [
        "conflict_id",
        "statement",
        "related_output_ids"
      ],
      "properties": {
        "conflict_id": {
          "$ref": "#/$defs/identifier"
        },
        "statement": {
          "type": "string",
          "minLength": 1
        },
        "related_output_ids": {
          "type": "array",
          "uniqueItems": true,
          "items": {
            "$ref": "#/$defs/identifier"
          }
        }
      }
    },
    "unknown": {
      "type": "object",
      "additionalProperties": false,
      "required": [
        "unknown_id",
        "statement"
      ],
      "properties": {
        "unknown_id": {
          "$ref": "#/$defs/identifier"
        },
        "statement": {
          "type": "string",
          "minLength": 1
        }
      }
    },
    "evidence_gap": {
      "type": "object",
      "additionalProperties": false,
      "required": [
        "gap_id",
        "statement",
        "question_ids"
      ],
      "properties": {
        "gap_id": {
          "$ref": "#/$defs/identifier"
        },
        "statement": {
          "type": "string",
          "minLength": 1
        },
        "question_ids": {
          "type": "array",
          "uniqueItems": true,
          "items": {
            "$ref": "#/$defs/identifier"
          }
        }
      }
    },
    "next_action": {
      "type": "object",
      "additionalProperties": false,
      "required": [
        "proposal_id",
        "action_type",
        "instruction",
        "rationale",
        "status"
      ],
      "properties": {
        "proposal_id": {
          "$ref": "#/$defs/identifier"
        },
        "action_type": {
          "enum": [
            "search",
            "extract",
            "verify",
            "analyze",
            "review",
            "resolve",
            "collect",
            "other"
          ]
        },
        "instruction": {
          "type": "string",
          "minLength": 1
        },
        "rationale": {
          "type": "string",
          "minLength": 1
        },
        "status": {
          "const": "candidate"
        }
      }
    },
    "next_method": {
      "type": "object",
      "additionalProperties": false,
      "required": [
        "proposal_id",
        "method_family",
        "rationale",
        "status"
      ],
      "properties": {
        "proposal_id": {
          "$ref": "#/$defs/identifier"
        },
        "method_family": {
          "type": "string",
          "minLength": 1
        },
        "rationale": {
          "type": "string",
          "minLength": 1
        },
        "status": {
          "const": "candidate"
        }
      }
    },
    "outputs": {
      "type": "object",
      "additionalProperties": false,
      "required": [
        "observations",
        "source_captures",
        "evidence_candidates",
        "candidate_findings",
        "counterevidence",
        "conflicts",
        "unknowns",
        "evidence_gaps",
        "candidate_next_actions",
        "candidate_next_methods"
      ],
      "properties": {
        "observations": {
          "type": "array",
          "items": {
            "$ref": "#/$defs/observation"
          }
        },
        "source_captures": {
          "type": "array",
          "items": {
            "$ref": "#/$defs/source_capture"
          }
        },
        "evidence_candidates": {
          "type": "array",
          "items": {
            "$ref": "#/$defs/evidence_candidate"
          }
        },
        "candidate_findings": {
          "type": "array",
          "items": {
            "$ref": "#/$defs/candidate_finding"
          }
        },
        "counterevidence": {
          "type": "array",
          "items": {
            "$ref": "#/$defs/counterevidence_candidate"
          }
        },
        "conflicts": {
          "type": "array",
          "items": {
            "$ref": "#/$defs/conflict"
          }
        },
        "unknowns": {
          "type": "array",
          "items": {
            "$ref": "#/$defs/unknown"
          }
        },
        "evidence_gaps": {
          "type": "array",
          "items": {
            "$ref": "#/$defs/evidence_gap"
          }
        },
        "candidate_next_actions": {
          "type": "array",
          "items": {
            "$ref": "#/$defs/next_action"
          }
        },
        "candidate_next_methods": {
          "type": "array",
          "items": {
            "$ref": "#/$defs/next_method"
          }
        }
      }
    },
    "provenance": {
      "type": "object",
      "additionalProperties": false,
      "required": [
        "trace_id",
        "produced_at",
        "implementation_id",
        "implementation_version",
        "input_content_digests"
      ],
      "properties": {
        "trace_id": {
          "$ref": "#/$defs/identifier"
        },
        "produced_at": {
          "type": "string",
          "format": "date-time"
        },
        "implementation_id": {
          "type": "string",
          "minLength": 1
        },
        "implementation_version": {
          "$ref": "#/$defs/semver"
        },
        "input_content_digests": {
          "type": "array",
          "minItems": 1,
          "uniqueItems": true,
          "items": {
            "$ref": "#/$defs/digest"
          }
        }
      }
    },
    "adoption_boundary": {
      "type": "object",
      "additionalProperties": false,
      "required": [
        "research_state_mutation_performed",
        "outputs_are_candidates",
        "human_decision_required_for_authoritative_transition"
      ],
      "properties": {
        "research_state_mutation_performed": {
          "const": false
        },
        "outputs_are_candidates": {
          "const": true
        },
        "human_decision_required_for_authoritative_transition": {
          "const": true
        }
      }
    }
  }
}
