{"schema_version":"0.1.0","handoff_id":"HND-001","invocation_id":"INV-001","run_id":"RUN-001","project_id":"PRJ-1","capability":{"capability_id":"fixture.research-support","capability_version":"1.0.0","descriptor_digest":"sha256:7c490b81baad229a38ce3f1588721ccc496f37733fd082f86c278c387f445487","function_id":"investigate"},"execution_mode":"virtual","input_pins":{"invocation_digest":"sha256:769ba1437e8e1e29e7a972fe139d131630f4dda286af65973f07b684a3f0e768","context_pack_digest":"sha256:d6a91b9a6127f2ad396255ffdf95ea2d79a79a0339421c0936e36f7cba197bd8","project_config_digest":"sha256:9fa677cbca9f50f54055021d8c1f0febfe636795a96931174f2aef6052fb13fb","research_snapshot":{"snapshot_id":"SNP-1","revision":0,"content_digest":"sha256:eb0b25b360df904b109f94bf5cdb3d4a7e3d59fca40fc48a1f95ffca26657391"},"effective_profile_set_digest":"sha256:ab4631d96e1d81f6f8cb3fda8d62dc5fbf5c7500895001cb91f16f803d336e17"},"preserved_context":{"research_attention_ids":["ATT-FIXTURE-001","ATT-FIXTURE-002"],"project_guard_ids":["GUARD-REQ-001","GUARD-PRO-001","GUARD-CLAIM-001"],"effective_constraint_paths":["evidence.capture.locator_precision","evidence.capture.required_fields","narrative.semantic_stages","organization.review.roles","publication.outputs.formats"]},"validation":{"status":"valid","issues":[]},"outputs":{"observations":[{"observation_id":"OBS-001","statement":"Synthetic fixture observation only.","epistemic_mode":"synthetic","evidence_candidate_ids":["EVC-001"]}],"source_captures":[{"capture_id":"CAP-001","locator":"fixture://source/1#synthetic-view","content_digest":"sha256:2222222222222222222222222222222222222222222222222222222222222222","origin":{"origin_type":"project_source_reference","resource_reference_id":"REF-SOURCE-001"}}],"evidence_candidates":[{"evidence_candidate_id":"EVC-001","statement":"Synthetic candidate evidence produced by virtual execution.","source_basis":{"basis_type":"source_capture","capture_id":"CAP-001"},"locator":"fixture://source/1#synthetic-view","epistemic_mode":"synthetic","limitations":["Virtual fixture output is not empirical evidence."]}],"candidate_findings":[{"candidate_finding_id":"CFND-001","question_ids":["RQ-1"],"statement":"The virtual fixture can return structured candidates without adopting them.","supporting_evidence_candidate_ids":["EVC-001"],"counterevidence_candidate_ids":["CEV-001"],"boundary_conditions":["Synthetic fixture semantics only."],"limitations":["No empirical inference is permitted."],"epistemic_mode":"synthetic"}],"counterevidence":[{"counterevidence_id":"CEV-001","statement":"The fixture cannot establish a real-world causal effect.","source_basis":{"basis_type":"resource_reference","resource_reference_id":"REF-SOURCE-001"},"locator":"fixture://source/1","epistemic_mode":"synthetic"}],"conflicts":[{"conflict_id":"CONFLICT-001","statement":"A candidate next method may be proposed but not selected by the capability.","related_output_ids":["NM-001"]}],"unknowns":[{"unknown_id":"UNK-001","statement":"No real-world effect is established by this virtual fixture."}],"evidence_gaps":[{"gap_id":"GAP-001","statement":"Empirical evidence remains required for any real-world effect claim.","question_ids":["RQ-1"]}],"candidate_next_actions":[{"proposal_id":"NA-001","action_type":"collect","instruction":"Collect authorized empirical evidence before considering a real-world effect claim.","rationale":"Virtual output cannot fill the empirical gap.","status":"candidate"}],"candidate_next_methods":[{"proposal_id":"NM-001","method_family":"fixture-follow-up","rationale":"A follow-up method could test the unresolved empirical gap.","status":"candidate"}]},"provenance":{"trace_id":"TRACE-001","produced_at":"2026-01-01T00:00:01Z","implementation_id":"plugin.fixture.research-support","implementation_version":"1.0.0","input_content_digests":["sha256:7c490b81baad229a38ce3f1588721ccc496f37733fd082f86c278c387f445487","sha256:d6a91b9a6127f2ad396255ffdf95ea2d79a79a0339421c0936e36f7cba197bd8","sha256:769ba1437e8e1e29e7a972fe139d131630f4dda286af65973f07b684a3f0e768"]},"adoption_boundary":{"research_state_mutation_performed":false,"outputs_are_candidates":true,"human_decision_required_for_authoritative_transition":true},"handoff_digest":"sha256:f97ab79d19681df782b3c0fd1775c8a4b6f7832f201271bd20f83b7c5e54c265"}
